{
  "schema_version":"0.1","run_id":"unit-run","task_id":"RM-TEST-001","invocation_id":"inv-005","attempt":2,"role":"implementation_engineer","phase":"implementation","status":"completed","requires_tony":false,
  "authorization":{"reference":"prototype-acceptance-authorization","scope_hash":"sha256:test-scope-v1","worktree_creation_authorized":true},
  "payload":{"format":"implementation-package","path":"packages/inv-005.md"},"evidence":[]
}
