{
  "schema_version":"0.1","run_id":"unit-run","task_id":"RM-TEST-001","invocation_id":"inv-006","attempt":1,"role":"independent_reviewer","phase":"review","status":"completed","requires_tony":false,
  "authorization":{"reference":"prototype-acceptance-authorization","scope_hash":"sha256:test-scope-v1","worktree_creation_authorized":true},
  "payload":{"format":"review-findings","path":"packages/inv-006.md"},"evidence":[{"kind":"review","value":"No findings."}]
}
