{
  "schema_version":"0.1","run_id":"unit-run","task_id":"RM-TEST-001","invocation_id":"inv-002","attempt":1,"role":"repository_committer","phase":"repository_preflight","status":"completed","requires_tony":false,
  "authorization":{"reference":"prototype-acceptance-authorization","scope_hash":"sha256:test-scope-v1","worktree_creation_authorized":true},
  "payload":{"format":"repository-evidence","path":"packages/inv-002.md"},"evidence":[]
}
