{
  "schema_version":"0.1","run_id":"unit-run","task_id":"RM-TEST-001","invocation_id":"inv-003","attempt":1,"role":"implementation_engineer","phase":"implementation","status":"blocked","requires_tony":false,
  "authorization":{"reference":"prototype-acceptance-authorization","scope_hash":"sha256:test-scope-v1","worktree_creation_authorized":true},
  "payload":{"format":"implementation-package","path":"packages/inv-003.md"},
  "blocker":{"code":"WORKTREE_REQUIRED","summary":"A clean isolated worktree is required.","required_capability":"repository_worktree_create","resume_role":"implementation_engineer","resume_token":"resume-inv-003","retryable":true},"evidence":[]
}
